Source,Type,Target,Relation,Domain,Range,Quantifier,Comment,Defined By,Label
Location,Class,,,,,,The geographical position where an event or entity is situated.,http://www.theworldavatar.com/kg/ontoHeatwave,Location
HeatwaveHistory,Class,,,,,,A record of past Heatwaves including relevant data and time series.,http://www.theworldavatar.com/kg/ontoHeatwave,Heatwave History
TimeSeries,Class,,,,,,A sequence of data points measured at successive time intervals.,http://www.theworldavatar.com/kg/ontoHeatwave,Time Series
ShapeFile,Class,Location,IS-A,,,,"A digital vector storage format for storing the location, shape, and attributes of geographic features.",http://www.theworldavatar.com/kg/ontoHeatwave,Shape File
http://www.opengis.net/ont/geosparql#Geometry,Class,Location,IS-A,,,,,http://www.opengis.net/ont/geosparql#,Geometry
Organization,Class,ShapeFile,IS-A,,,,"An entity that produces data, reports, or manages resources related to Heatwave events.",http://www.theworldavatar.com/kg/ontoHeatwave,Organization
FileUrl,Class,ShapeFile,IS-A,,,,A URL link that points to a file containing relevant information or data.,http://www.theworldavatar.com/kg/ontoHeatwave,File Url
occurredIn,Object Property,,,Heatwave,Location,,Links an Heatwave occurrence to the location where it took place,http://www.theworldavatar.com/kg/ontoHeatwave,occurred In
hasLocation,Object Property,,,http://sweetontology.net/phen/Event,Location,,Links an event to the geographic location where it occurred.,http://www.theworldavatar.com/kg/ontoHeatwave,has Location
hasHeatwaveHistory,Object Property,,,Location,HeatwaveHistory,,Connects a location to its associated Heatwave history.,http://www.theworldavatar.com/kg/ontoHeatwave,has Heatwave History
hasTimeSeries,Object Property,,,HeatwaveHistory,TimeSeries,,Associates Heatwave history with a time series of data points.,http://www.theworldavatar.com/kg/ontoHeatwave,has Time Series
hasShapeFile,Object Property,,,Location,ShapeFile,,Refers to the shapefile associated with a specific location.,http://www.theworldavatar.com/kg/ontoHeatwave,has Shape File
hasGeometry,Object Property,,,Location,http://www.opengis.net/ont/geosparql#Geometry,,Indicates the geometric representation of a location.,http://www.theworldavatar.com/kg/ontoHeatwave,has Geometry
isProducedBy,Object Property,,,ShapeFile,Organization,,Identifies the organization that produced a shapefile.,http://www.theworldavatar.com/kg/ontoHeatwave,is Produced By
hasFileUrl,Object Property,,,ShapeFile,FileUrl,,Points to the URL of the shapefile.,http://www.theworldavatar.com/kg/ontoHeatwave,has File Url
hasAltitude,,,,Location,double,,"This property represents the altitude of a specific location, expressed as a floating-point number.",http://www.theworldavatar.com/kg/ontoHeatwave,has Altitude
hasLat,Data Property,,,Location,double,,"This property represents the latitude coordinate of a specific Heatwave location, expressed as a floating-point number.",http://www.theworldavatar.com/kg/ontoHeatwave,has Lat
hasLon,Data Property,,,Location,double,,"This property represents the longitude coordinate of a specific Heatwave location, expressed as a floating-point number.",http://www.theworldavatar.com/kg/ontoHeatwave,has Lon
lastUpdateOn,Data Property,,,ShapeFile,date time,,This property represents the timestamp of the most recent update related to the Heatwave situation.,http://www.theworldavatar.com/kg/ontoHeatwave,last Update On